{
  "schema": "temple-of-maat/knowledge-kernel-v1",
  "version": "1.0.0",
  "updated": "2026-08-14",
  "privacy": "public-canonical-only",
  "sourceRegistry": "research/knowledge-kernel/source-registry.v1.json",
  "methodRegistry": "research/knowledge-kernel/method-registry.v1.json",
  "records": [
    {
      "recordId": "chamber.01",
      "entityType": "chamber",
      "displayName": "01 — Bifruiah",
      "provenanceClasses": ["current-implementation", "temple-synthesis"],
      "historicalStatus": "current-implementation",
      "implementationStatus": "current",
      "sourceRefs": ["source.temple.chambers-v3"],
      "sourceLocator": "chambers.json → chamber 01",
      "attributes": {"number": 1, "thirdName": "Bifruiah", "angel": "Vehuiah", "daemon": "Bifrons", "office": "Keeper of Remembered Beginnings", "pillar": "Jachin", "law": "INITIATE WITHOUT ERASURE", "thresholdSealName": "First Stone"},
      "aliases": [], "supersedes": [], "supersededBy": [],
      "createdAt": "2026-08-14", "reviewedAt": "2026-08-14", "reviewStatus": "reviewed"
    },
    {
      "recordId": "chamber.02",
      "entityType": "chamber",
      "displayName": "02 — Orialiel",
      "provenanceClasses": ["current-implementation", "temple-synthesis"],
      "historicalStatus": "current-implementation",
      "implementationStatus": "current",
      "sourceRefs": ["source.temple.chambers-v3"],
      "sourceLocator": "chambers.json → chamber 02",
      "attributes": {"number": 2, "thirdName": "Orialiel", "angel": "Jeliel", "daemon": "Orias", "office": "Steward of Concordant Authority", "pillar": "Middle", "law": "AUTHORITY SERVES HARMONY", "thresholdSealName": "Second Binding"},
      "aliases": [], "supersedes": [], "supersededBy": [],
      "createdAt": "2026-08-14", "reviewedAt": "2026-08-14", "reviewStatus": "reviewed"
    },
    {
      "recordId": "chamber.03",
      "entityType": "chamber",
      "displayName": "03 — Andritael",
      "provenanceClasses": ["current-implementation", "temple-synthesis"],
      "historicalStatus": "current-implementation",
      "implementationStatus": "current",
      "sourceRefs": ["source.temple.chambers-v3"],
      "sourceLocator": "chambers.json → chamber 03",
      "attributes": {"number": 3, "thirdName": "Andritael", "angel": "Sitael", "daemon": "Andras", "office": "Warden of Necessary Endings", "pillar": "Boaz", "law": "END WHAT DEVOURS LIFE", "thresholdSealName": "Third Severance"},
      "aliases": [], "supersedes": [], "supersededBy": [],
      "createdAt": "2026-08-14", "reviewedAt": "2026-08-14", "reviewStatus": "reviewed"
    },
    {
      "recordId": "declaration.maat.001",
      "entityType": "maat-declaration",
      "displayName": "Declaration Seed 01 — Wrongdoing",
      "provenanceClasses": ["historical-scholarship", "temple-synthesis"],
      "historicalStatus": "modern-synthesis",
      "implementationStatus": "seed",
      "sourceRefs": ["source.egyptian.book-dead-spell-125-concordance"],
      "sourceLocator": "Spell 125 declaration-of-innocence complex",
      "content": {"mode": "normalized-temple-language", "text": "I have not done wrong.", "language": "English", "limitations": ["Normalized Temple wording for a seed record; not presented as a unique canonical English translation of Spell 125."]},
      "attributes": {"theme": "wrongdoing", "historicalBasis": "Spell 125 declarations of innocence"},
      "aliases": [], "supersedes": [], "supersededBy": [],
      "createdAt": "2026-08-14", "reviewedAt": null, "reviewStatus": "provisional"
    },
    {
      "recordId": "declaration.maat.002",
      "entityType": "maat-declaration",
      "displayName": "Declaration Seed 02 — Theft",
      "provenanceClasses": ["historical-scholarship", "temple-synthesis"],
      "historicalStatus": "modern-synthesis",
      "implementationStatus": "seed",
      "sourceRefs": ["source.egyptian.book-dead-spell-125-concordance"],
      "sourceLocator": "Spell 125 declaration-of-innocence complex",
      "content": {"mode": "normalized-temple-language", "text": "I have not stolen.", "language": "English", "limitations": ["Normalized Temple wording for a seed record; not presented as a unique canonical English translation of Spell 125."]},
      "attributes": {"theme": "theft", "historicalBasis": "Spell 125 declarations of innocence"},
      "aliases": [], "supersedes": [], "supersededBy": [],
      "createdAt": "2026-08-14", "reviewedAt": null, "reviewStatus": "provisional"
    },
    {
      "recordId": "declaration.maat.003",
      "entityType": "maat-declaration",
      "displayName": "Declaration Seed 03 — False Speech",
      "provenanceClasses": ["historical-scholarship", "temple-synthesis"],
      "historicalStatus": "modern-synthesis",
      "implementationStatus": "seed",
      "sourceRefs": ["source.egyptian.book-dead-spell-125-concordance"],
      "sourceLocator": "Spell 125 declaration-of-innocence complex",
      "content": {"mode": "normalized-temple-language", "text": "I have not spoken lies.", "language": "English", "limitations": ["Normalized Temple wording for a seed record; not presented as a unique canonical English translation of Spell 125."]},
      "attributes": {"theme": "truthful-speech", "historicalBasis": "Spell 125 declarations of innocence"},
      "aliases": [], "supersedes": [], "supersededBy": [],
      "createdAt": "2026-08-14", "reviewedAt": null, "reviewStatus": "provisional"
    },
    {
      "recordId": "passage.ptahhotep.20",
      "entityType": "source-passage",
      "displayName": "Ptahhotep §20 — Justice of Listening",
      "provenanceClasses": ["historical-scholarship", "temple-synthesis"],
      "historicalStatus": "historical-context",
      "implementationStatus": "seed",
      "sourceRefs": ["source.temple.maat-listening-heart"],
      "sourceLocator": "Papyrus Prisse, column 9, lines 3–7; project careful paraphrase",
      "content": {"mode": "careful-paraphrase", "text": "When you hold authority, listen patiently to the petitioner. Do not interrupt before they have emptied their heart; full attention can restore dignity even when the request cannot be granted.", "language": "English", "limitations": ["Careful project paraphrase, not a direct quotation from Papyrus Prisse."]},
      "attributes": {"themes": ["listening", "justice", "restraint", "dignity"]},
      "aliases": [], "supersedes": [], "supersededBy": [],
      "createdAt": "2026-08-14", "reviewedAt": "2026-08-14", "reviewStatus": "reviewed"
    },
    {
      "recordId": "passage.book-dead.125",
      "entityType": "source-passage",
      "displayName": "Book of the Dead Spell 125 — Hall of the Two Truths",
      "provenanceClasses": ["historical-scholarship"],
      "historicalStatus": "historical-context",
      "implementationStatus": "seed",
      "sourceRefs": ["source.egyptian.book-dead-spell-125-concordance"],
      "sourceLocator": "Spell 125",
      "content": {"mode": "careful-paraphrase", "text": "Spell 125 centers declarations of innocence, the forty-two assessors, judgment, and the weighing of the heart in relation to Ma'at.", "language": "English", "limitations": ["Project concordance summary rather than a reproduction of a modern copyrighted translation."]},
      "attributes": {"themes": ["truth", "justice", "right-order", "ethical-accountability"]},
      "aliases": [], "supersedes": [], "supersededBy": [],
      "createdAt": "2026-08-14", "reviewedAt": "2026-08-14", "reviewStatus": "reviewed"
    },
    {
      "recordId": "passage.quran.49.13",
      "entityType": "source-passage",
      "displayName": "Qur'an 49:13 — Nations, Tribes, and Conduct",
      "provenanceClasses": ["source"],
      "historicalStatus": "historical-source",
      "implementationStatus": "seed",
      "sourceRefs": ["source.quran.tanzil-pickthall"],
      "sourceLocator": "Qur'an 49:13; Pickthall English alignment",
      "content": {"mode": "exact-source", "text": "O mankind! Lo! We have created you male and female, and have made you nations and tribes that ye may know one another.", "language": "English", "rightsNote": "Pickthall translation is identified by the project source edition as public domain in the United States; Arabic Tanzil licensing is separate.", "limitations": ["This seed stores only a short English excerpt; consult the source edition for the complete verse and Arabic text."]},
      "attributes": {"themes": ["human-diversity", "mutual-recognition", "conduct"]},
      "aliases": [], "supersedes": [], "supersededBy": [],
      "createdAt": "2026-08-14", "reviewedAt": "2026-08-14", "reviewStatus": "reviewed"
    },
    {
      "recordId": "concept.truth",
      "entityType": "concept",
      "displayName": "Truth",
      "provenanceClasses": ["temple-synthesis"],
      "historicalStatus": "not-applicable",
      "implementationStatus": "seed",
      "sourceRefs": ["source.egyptian.book-dead-spell-125-concordance"],
      "attributes": {"definition": "A cross-record concept node used to index claims about truthfulness without asserting that traditions mean exactly the same thing."},
      "aliases": [], "supersedes": [], "supersededBy": [],
      "createdAt": "2026-08-14", "reviewedAt": "2026-08-14", "reviewStatus": "reviewed"
    },
    {
      "recordId": "concept.justice",
      "entityType": "concept",
      "displayName": "Justice",
      "provenanceClasses": ["temple-synthesis"],
      "historicalStatus": "not-applicable",
      "implementationStatus": "seed",
      "sourceRefs": ["source.egyptian.book-dead-spell-125-concordance", "source.temple.maat-listening-heart"],
      "attributes": {"definition": "A comparative indexing concept; each source retains its own historical and doctrinal context."},
      "aliases": [], "supersedes": [], "supersededBy": [],
      "createdAt": "2026-08-14", "reviewedAt": "2026-08-14", "reviewStatus": "reviewed"
    },
    {
      "recordId": "concept.listening",
      "entityType": "concept",
      "displayName": "Listening",